{
  "subject": "So1anaExample",
  "chain": "solana",
  "public_key_exposed": true,
  "exposure_age_blocks": 50000,
  "value_at_risk_usd": 150000,
  "signatures_per_day": 1200,
  "key_reuse_detected": false,
  "replay_surface_present": false,
  "signature_family": "ed25519",
  "pq_authorization_available": false,
  "hybrid_authorization_available": false,
  "chain_upgrade_latency_days": 900
}